{
	"contract_version": "review-weekly-v1",
	"generated_at": "2025-07-14T12:00:00.000Z",
	"summary": {
		"stale_high_value": 1,
		"contradictions": 1,
		"poison_candidates": 1,
		"deferred": 1
	},
	"cases": [
		{
			"kind": "stale_high_value",
			"case_id": "stale:11111111-1111-1111-1111-111111111111",
			"entry_id": "11111111-1111-1111-1111-111111111111",
			"title": "How auth flows through the API gateway",
			"impact_level": "critical",
			"trust_score": 0.72,
			"days_since_validation": 45,
			"hint": "Refresh evidence or deprecate — high-impact entry has gone stale"
		},
		{
			"kind": "contradiction",
			"case_id": "contradiction:22222222-2222-2222-2222-222222222222",
			"contradiction_id": "22222222-2222-2222-2222-222222222222",
			"entry_a": {
				"id": "aaaaaaaa-aaaa-aaaa-aaaa-aaaaaaaaaaaa",
				"title": "Retry failed jobs up to 3 times"
			},
			"entry_b": {
				"id": "bbbbbbbb-bbbb-bbbb-bbbb-bbbbbbbbbbbb",
				"title": "Never retry failed jobs — fail fast"
			},
			"description": "Conflicting guidance on job retry policy",
			"created_at": "2025-07-10T09:30:00.000Z",
			"hint": "Resolve: keep A, keep B, keep both, or reject both"
		},
		{
			"kind": "poison_candidate",
			"case_id": "poison:33333333-3333-3333-3333-333333333333",
			"entry_id": "33333333-3333-3333-3333-333333333333",
			"title": "Use memoize() for every pure helper",
			"trust_score": 0.28,
			"invalidation_count": 4,
			"hint": "Repeated invalidations — consider `memory poison` or deprecate"
		}
	]
}
